{
  "statement": "给定一个整数数组，删除重复出现的数值，每个不同数值只保留一次。\n结果中各数值的顺序必须与它们在原数组中第一次出现的顺序一致。",
  "inputSpec": "第一行包含数组长度n。\n第二行包含n个整数。",
  "outputSpec": "第一行输出不同数值的数量k。\n第二行按第一次出现的顺序输出k个整数，用空格分隔。",
  "constraints": "1 <= n <= 200000\n-1000000000 <= 数组元素 <= 1000000000",
  "examples": [
    {"input": "6\n3 1 3 2 1 2\n", "output": "3\n3 1 2\n"},
    {"input": "4\n-2 -2 -2 -2\n", "output": "1\n-2\n"},
    {"input": "1\n0\n", "output": "1\n0\n"}
  ],
  "language": "python3",
  "ioMode": "standardInputOutput"
}
