{
  "statement": "给定n个闭区间，合并所有有交集的区间，输出合并结果。\n两个区间端点相接也视为有交集，例如[1,2]与[2,4]合并为[1,4]。输入顺序不固定，可以出现重复区间或包含关系。",
  "inputSpec": "第一行是区间数量n。\n随后n行，每行包含左端点l和右端点r。",
  "outputSpec": "第一行输出合并后区间数量k。\n随后k行按左端点从小到大输出每个区间的左右端点。",
  "constraints": "1 <= n <= 100000\n-1000000000 <= l <= r <= 1000000000",
  "examples": [{"input": "3\n1 2\n2 4\n7 8\n", "output": "2\n1 4\n7 8\n"}, {"input": "3\n2 3\n1 5\n1 5\n", "output": "1\n1 5\n"}],
  "language": "python3",
  "ioMode": "standardInputOutput"
}
